MCQ,Choices,Correct
When was the academic discipline of artificial intelligence established?,a: 1950 | b: 1960 | c: 1970 | d: 1980,a
Who posed fundamental questions about machine reasoning similar to human intelligence in a groundbreaking 1950 paper?,a: Alan Turing | b: Harold Cohen | c: Andrey Markov | d: Daedalus,a
"Which automaton creator was described as having designed machines capable of writing text, generating sounds, and playing music in ancient Greek civilization?",a: Alan Turing | b: Hero of Alexandria | c: Harold Cohen | d: Andrey Markov,b
What type of models have long been used to model natural languages and predict data?,a: Generative models | b: Discriminative models | c: Statistical models | d: Neural networks,c
"In what year was GPT-4 released, which some argue could be viewed as an early version of an artificial general intelligence system?",a: 2022 | b: 2023 | c: 2024 | d: 2025,b
